<?xml version="1.0"?>
<xsd:schema xmlns:xsd="http://www.w3.org/2001/XMLSchema"
            targetNamespace="http://www.books.org"
            xmlns="http://www.books.org"
            elementFormDefault="qualified">
    <xsd:complexType name="PublicationType" abstract="true">
        <xsd:sequence>
            <xsd:element name="Title" type="xsd:string"/>
            <xsd:element name="Author" type="xsd:string" minOccurs="0" maxOccurs="unbounded"/>
            <xsd:element name="Date" type="xsd:gYear"/>
        </xsd:sequence>
    </xsd:complexType>
    <xsd:complexType name="BookType">
        <xsd:complexContent>
            <xsd:extension base="PublicationType" >
                <xsd:sequence>
                    <xsd:element name="ISBN" type="xsd:string"/>
                    <xsd:element name="Publisher" type="xsd:string"/>
                </xsd:sequence>
            </xsd:extension>
        </xsd:complexContent>
    </xsd:complexType>
    <xsd:complexType name="MagazineType">
        <xsd:complexContent>
            <xsd:restriction base="PublicationType">
                <xsd:sequence>
                    <xsd:element name="Title" type="xsd:string"/>
                    <xsd:element name="Author" type="xsd:string" minOccurs="0" maxOccurs="0"/>
                    <xsd:element name="Date" type="xsd:gYear"/>
                </xsd:sequence>
            </xsd:restriction>
        </xsd:complexContent>
    </xsd:complexType>
    <xsd:element name="Publication" type="PublicationType"/>
    <xsd:element name="BookStore">
        <xsd:complexType>
            <xsd:sequence>
                <xsd:element ref="Publication" maxOccurs="unbounded"/>
            </xsd:sequence>
        </xsd:complexType>
    </xsd:element>
</xsd:schema>