<?xml version="1.0"?>
<BookStore xmlns="http://www.books.org"
           xmlns:xsi="http://www.w3.org/2001/XMLSchema-instance"
           xsi:schemaLocation=
                              "http://www.books.org
                               BookStore.xsd">
        <Publication xsi:type="MagazineType">
                <Title>Natural Health</Title>
                <Date>1999</Date>
        </Publication>
        <Publication xsi:type="BookType">
                <Title>My Life and Times</Title>
                <Author>Paul McCartney</Author>
                <Date>1998</Date>
                <ISBN>1-56592-235-2</ISBN>
                <Publisher>McMillin Publishing</Publisher>
        </Publication>
        <Publication xsi:type="BookType">
                <Title>The First and Last Freedom</Title>
                <Author>J. Krishnamurti</Author>
                <Date>1954</Date>
                <ISBN>0-06-064831-7</ISBN>
                <Publisher>Harper &amp; Row</Publisher>
        </Publication>
</BookStore>
